,id_key,headline,body,headline_sentiment,relevance,year,region
31,9562,Hurricane Island Unveils a New Research Station | Maine Boats Homes & Harbors,"Boaters passing by Hurricane Island recently might have noticed a decidedly modern-looking structure perched on one of the island’s old granite piers, just feet from the ocean’s edge. This new state-of-the-art field research station mark’s the island’s new life as a center for cutting-edge scientific research and education in a unique marine environment. For many years Hurricane Island provided a base for learning life skills in a watery setting as part of the Outward Bound program. More recently, the 125-acre island off Vinalhaven has been home to the nonprofit Hurricane Island Center for Science and Leadership, which hosts science camps for students and conducts marine research. Current projects include several involving the study of scallops and aquaculture. The island’s location in Penobscot Bay at the confluence of the eastern and western Maine coastal currents and near the discharge of freshwater from the Penobscot River make it an ideal place for research, according to University of Maine marine biologist Bob Steneck. Windows in the second floor lab look out over Hurricane Sound and the waters where students in the lab will conduct research. Gulf of Maine waters are warming faster than 99 percent of ocean waters worldwide, but there is little data to shed light on the causes and consequences of these changing ocean temperatures, Steneck said. The new research station will serve as a science facility and a hub to connect local students, teachers, scientists, community leaders, and fishermen in shared efforts to better understand the marine environment. The new building’s construction is as innovative as the research it will enable, according to speakers among the phalanx of politicians, marine biologists, trustees, and supporters, who trekked to the island last summer to celebrate the completion of the new structure. The structure, 1,100 square feet above and 1,100 square feet below, features a passive-house “envelope” that minimizes the building’s power consumption from the solar micro-grid that powers the Hurricane campus, keeping emissions and environmental impact to a minimum. The new building had not yet been finished last summer as fundraising continued to cover the cost of the $2 million structure. News in late August of a $500,000 THRIVE forgivable loan through the Finance Authority of Maine was a major boost. The building was designed and built by Belfast-based OPAL, whose executive partner, Matt O’Malia, was on hand for the August event. OPAL faced major logistical hurdles on the project, including working and delivering material to an unbridged island in harsh side-season conditions. The structure showcases the future role of sustainable Maine forestry products, O’Malia said, explaining that it is carbon-negative because the building materials—cross-laminated timber, glulam beams, and wood-fiber panels—store more carbon than was used to produce them. Sustainable building practices such as these will play a key role in combatting climate change, whose effects will be studied in the lab, O’Malia noted. “If we can build this on a rocky promontory in Penobscot Bay, we can take this model and replicate it across the country,” he said. “This project proves these buildings are possible.” The building is insulated with a wood fiber product. OPAL’s sister company TimberHP recently began manufacturing insulation in a former paper mill in Madison, using wood-fiber waste from the lumber industry, in a first-of-its kind operation in the United States. The new factory was not yet online when work began on the Hurricane Island structure, which meant its wood insulation had to be imported from Germany, O’Malia explained. While the structure has been completed, the building still needs to be fully equipped. Plans call for indoor flowing seawater tanks, which will allow scientists and students to interact with species in a controlled environment just a few hundred yards from the island’s experimental aquaculture site where scallops, kelp, mussels, oysters and other specimens can be grown or collected from the wild. Educational projects on the island include the development of a year-long high school curriculum in partnership with the North Haven Community School of interdisciplinary coastal study known as the Offshore Year, with emphasis on environmental science, civic engagement, and the arts. Hurricane Island trustees and supporters looked as Maine Gov. Janet Mills cut the ribbon,  actually a fishing rope, at last summer’s ceremony for the new field research station. Comparing the vast expenses of research vessels to the cost-effective opportunities of a centrally located and sustainable research station, Steneck said research around aquaculture at facilities such as this one is key. “What I’m seeing now throughout the state of Maine and the world is the rise of aquaculture, which has all these new questions that arise from it. We’ve got to have the science to know what’s going on and that’s why I’m so passionately in favor of this program,” he said. In the late 1800s and early 1900s, Hurricane Island was home to a thriving granite quarrying business, which collapsed suddenly leaving a ghost town on the island. Maine biologist Rick Wahle compared that collapse to changes now affecting Maine’s fishing communities. The lobster fishery, which Wahle called the country’s single most valuable species fishery, faces unprecedented challenges, as a result of ocean warming. Research stations like this one, he said, will be key to finding ways to diversify the fishing portfolio.",neutral,seaweed aquaculture,2023,Maine
32,9577,Scarborough rivers proposed for 3 oyster farms – The Forecaster,"More oysters could soon be farmed in local rivers.  Two lease applicants are holding a scoping session on Monday, Oct. 23, at 6 p.m. at the Scarborough Municipal building, 295 U.S. Route 1. Matthew Hassler and Robert Willette have scheduled the session, as required by the Maine Department of Marine Resources application process.  An email to the applicants was not returned by press time Thursday. The public scoping session “will discuss a proposed aquaculture lease application to raise American/Eastern oysters using suspended culture techniques in three proposed locations,” according to a press release from the DMR. Two of the three proposed locations are in the Nonesuch River in Scarborough and the third is in the Spurwink River on the border of Scarborough and Cape Elizabeth. Information provided by DMR indicates that more than 3 acres in the two areas on the Nonesuch River are in the lease application. The size was not indicated for the Spurwink River.  Willette is a member of the town’s Shellfish Conservation Commission and has served as the chairman. Town Councillor Peter Hayes, who serves as a liaison to the Shellfish Conservation Commission, said Nonesuch Oysters and Pine Point Oysters already operate oyster farms in the Nonesuch River.  Jeff Nichols, communications director for the DMR, said the session is the first step in the process of getting lease application approved. Notices are sent to communities and landowners adjacent to the lease site.  The sessions are designed to provide an opportunity for residents to learn about the proposals and to have an informal discussion with applicants.",good,seaweed aquaculture,2017,Maine
33,9579,Harpswell group hears warning about rising ocean acidity – The Forecaster,"For those paying attention to Maine’s shellfish industry, new predators who pose a threat to the shell-sporting species are hogging headlines. But another risk to the state’s coastal industries is perched on the horizon, with ominous, lesser-known outcomes that could potentially affect lobster, too. The waters are warming, and they’re also getting more acidic, Aaron Strong, a University of Maine scientist studying the gulf’s changing oceans, told the Harpswell Heritage Land Trust Oct. 17. Strong spoke about the looming threat of ocean acidification, a climate-change-induced plunging of ocean pH that is experiencing an especially rapid rate of occurrence along Maine’s coastline. His talk was part of the land trust’s series on Maine’s changing oceans. In his analogy, the damage by invasive green crabs and milky ribbon worms is something akin to an infection in Casco Bay’s clam flats – an acute problem with tangible consequences. Ocean acidification, on the other hand, is more like the sea’s rising blood pressure: a foreboding, chronic ailment with a hazier set of outcomes. Although one can guess. Strong’s provocatively titled talk –”Ocean Acidification: Will lobsters and clams disappear'” – hinted at the worst-case scenario: a more acidic ocean will prevent shelled creatures from forming their shells. He explained that acidification affects the amount of calcium carbonate in the water, which is needed to create a shell. The thought of Maine without lobsters – let alone clams and oysters – not only threatens the state’s tourism industry, but a $700 million industry that supports an entire coastline of fishing communities. Globally, scientists estimate economic damages in the hundreds of billions by 2100. Strong assured his audience that clam and lobster shells are not dissolving in Maine’s waters just yet. But he said he knows of oyster farmers – a key group in Maine’s emerging aquaculture industry – that have already felt the effects of changing carbonate levels on larval populations. At least one farmer left the state for Hawaii, he said. There is less known about how acidification will affect lobster shells, as opposed to clam and oyster shells. In more acidic environments, “we see craziness in the metabolism of juvenile lobsters,” Strong said. But he predicted around another two years of research is needed until scientists have a clearer picture of how lobsters could be affected. Rising water temperatures, which could affect larval populations, might pose a bigger threat, he added. But compared to the rest of the globe, he said, “the Gulf of Maine is uniquely vulnerable.” Increased carbon emissions are causing pH – the scale used in chemistry to measure acids and bases – to drop “really, really fast,” he explained. Other, more localized factors cause fluctuations, as well – such as nutrient pollution from septic and wastewater, and extreme weather. These escalated, environmental changes are hitting a state with a lot to lose in the absence of a productive ocean. Work is ongoing to combat the issue, Strong said, mostly as a grassroots effort by scientists, academics, and nonprofit organizations. Notably without state funding, they have formed councils to learn more about what local communities can do to help shield coastal industries, remediate waters, and slow the rate of change. If local drivers are accelerating acidification, Strong said communities like Harpswell might be able to play a direct role in those efforts. For example, the town can protect water quality through septic and wastewater management. To an extent, that is already on the town’s radar; selectmen and staff met with a Department of Marine Resource to discuss water quality during an August workshop. Setting up a more robust water quality monitoring network is a good place to start, Strong said. Right now, there are a few sensors in the bay that track pH levels and some chemical readings, including one near Chebeague Island. But Strong called for the expansion of those programs, which civilians are able to participate in as volunteers. With more data, scientists might be able to create “real-time ecological forecasts” to identify “hot spots” for shellfish harvesters – analogous to a weather report, he said. As far as remediation, there’s the promise of kelp farms. Through underwater photosynthesis, the seaweed has the potential to reverse the effects of greenhouse emissions, creating “a halo effect.” “Will a bunch of kelp farms change the system'” Strong asked. Like so many things, he reiterated, the answer is still unknown.",bad,seaweed aquaculture,2017,Maine
34,9584,"South Portland pier presents promise, problems – The Forecaster","The city is considering ways to improve the Portland Street Pier so it will better accommodate commercial fishermen and widen their reach to include the fast-growing aquaculture market. At a City Hall meeting Dec. 14 with officials and stakeholders about how to best utilize the pier, City Councilor Claude Morgan said the city must invest in repairs along with a vision for the property. The meeting was held to update stakeholders on the context for the pier project, as well as provide an opportunity for input. The city hired consulting and engineering firm GEI Consultants of Portland in November to conduct a site assessment, a conceptual design and a feasibility analysis. The consulting work will cost nearly $47,000 and is being paid for by a Maine Coastal Program grant awarded last spring.  In an overview of what are likely important considerations for the project, Sam Merrill of GEI, who lives close to the pier, said the structural framework is strong, although cosmetic improvements are needed. Expansion should also be considered, Merrill said. He added issues such as dredging, cold storage, the dimensions and the number of slips allowed all must be decided, as well as how to best mitigate wind currents. A follow-up meeting on the project is slated for April and will include design and economic comparisons. Assistant City Manager Josh Reny said the big picture includes economic development, and opportunities the pier could create for the city.  Morgan, who lives just a few blocks from the pier, said South Portland has a unique waterfront, although he identifies some of the uses as outdated, and said there is an opportunity to take something old and rebuild it anew. The pier, in Ferry Village, has been city-owned since the 19th century, when it was constructed for shipbuilding. The property now leases 15 slips to lobster and tuna fishermen from April to November. Revenue from those leases ranges from $20,000 to $25,000, on which the city breaks even, Reny said. As a result the pier is not self-sustaining. Challenges also include no business and maintenance plans for the pier and security concerns, he added. Scarborough lobsterman Rick Sullivan, who is now semi-retired and hauls about 200 traps off his 32-foot boat Whistler, has used the dock for about 30 years to set and take up his gear. He said ideally, the pier should be widened and made into a year-round wharf. He said if the area around the pier is dredged, it could be used year-round and would attract more fishermen. “I couldn’t do without it. You can’t find a berth to tie a boat anymore, it’s the only working pier we have,” Sullivan said, adding commercial water access is becoming scarce. “It’s a good working pier,” he said, adding the fishermen get along well and solve challenges amongst themselves.  But he said the pier needs improvements, noting some of its planks need replacing and although it has a winch on one side, the tide has to be right for fishermen to be able to use the device.  Sullivan, who is usually done fishing by early December, also said winter northeast winds are hard on the pier and docked boats. “It’s not made for it, it gets smashed up,” he said, arguing a concrete pier and steel pilings would be a sound investment. “They will have to spend a lot of money here for the future,” Sullivan said, adding he is glad the city is exploring options to update the structure.  Also at the meeting was Gulf of Maine Research Institute aquaculture program manager Chris Vonderweidt, who shared data from a study on the market outlook for aquaculture programs in the state.  “The bottom won’t fall out anytime soon,” Vonderweidt said, adding Maine-grown shellfish is considered the gold standard among American chefs and the market will take as much as the state can produce. GMRI is involved because it works with working waterfronts on economic development, and Vonderweidt said within 10 miles of the pier there are 50 start-up sites as well as six commercial leases to grow mussels, oysters and kelp.  The city is considering allowing designated space for aquaculture farmers to use the pier, but one aquaculture farmer in attendance said it is a year-round, everyday business, so seasonal facilities and seasonal access are automatic disadvantages. GEI’s Varoujan Hagopian said fishing and aquaculture have different ways and means of doing things, and sometimes, harmony between the two breaks down. “We need to understand that,” he said. Collectively, the city, consultants, and fisherman must identify a functional design that supports all needs, he said. Designs may be for half commercial fishing use and half aquaculture, or two piers may be built to accomodate both uses, Hagopian suggested. He added the breakwater needs to be bigger, and must adequately protect the pier. He said a rock breakwater takes up a lot of space, and a wave screen would offer the same protection from the winds and use less space. Hagopian acknowledged parking at the pier will be an issue, and the design will have to be creative in looking at the area, and not just the property boundary lines. The properties on either side of the pier are privately owned, he noted.  Portland’s waterfront coordinator, Bill Needelman, said he encourages the city to consider what’s possible at the pier despite its land constraints, and consider synergies with Portland. As an example, he said if fueling is difficult at the South Portland pier, the Portland fish pier is just across the river. “Don’t worry about missing certain components if you can look at other properties to make it a functional facility,” Needelman said.  The Portland Street Pier in South Portland is one of the only docks available for commercial fishermen in the city, which is considering investments in the property.",neutral,seaweed aquaculture,2017,Maine
35,9586,Aquaculture business in Falmouth wants to expand lease – The Forecaster,"The Maine Department of Marine Resources will hold a public session Tuesday, March 6, to gather input on a proposed expansion of Wild Ocean Aquaculture’s current lease near Clapboard Island. The hearing starts at 6 p.m. and will be held at the Mason-Motz Activity Center, 190 Middle Road. Wild Ocean currently has a lease that allows for suspended blue sea mussels, scallops and various species of seaweed and kelp on approximately 11 acres southeast of the island. The hearing provides an opportunity to learn more about the proposal and to have an informal discussion with the applicants about their plans.",good,seaweed aquaculture,2018,Maine
36,9587,Fishermen invited to give feedback on South Portland pier redevelopment – The Forecaster,"The city is seeking input from commercial fisherman to help craft redevelopment plans for its public pier. South Portland has been considering ways to improve the Portland Street Pier to better accommodate commercial fishermen and widen their reach to include the fast-growing aquaculture market. A stakeholder meeting is set to take place March 19, from 5-7 p.m., at the Gulf of Maine Research Institute in Portland.  The pier, in Ferry Village, has been city-owned since the 19th century, when it was constructed for shipbuilding. The property now leases 15 slips to lobster and tuna fishermen from April-November. Revenue from those leases ranges from $20,000 to $25,000, on which the city breaks even, Assistant City Manager Joshua Reny has said.  As a result, the pier is not self-sustaining. Challenges also include maintenance and security, he added. The city hired consulting and engineering firm GEI Consultants of Portland last November to conduct a site assessment and feasibility analysis, and to provide a conceptual design. The consulting work will cost nearly $47,000 and is being paid for by a Maine Coastal Program grant awarded last spring.  In an overview of what are likely important considerations for the project, Sam Merrill of GEI said in a December meeting the structural framework is strong, although cosmetic improvements are needed. Expansion should also be considered, he said. Merrill added issues such as dredging, cold storage, the dimensions and the number of slips allowed all must be decided, as well as how to best mitigate wind currents. Reny said the big picture includes economic development, and opportunities the pier could create for the city.  Scarborough lobsterman Rick Sullivan, who is now semi-retired and hauls about 200 traps off a 32-foot boat, has used the dock for about 30 years to set and take up his gear. He said ideally, the pier should be widened and made into a year-round wharf. He said if the area around the pier is dredged, it could be used year-round and would attract more fishermen. Chris Vonderweidt, GMRI aquaculture program manager, shared with the city data from a study on the market outlook for aquaculture programs in the state. In support of the initiative, the quaculture program is conducting a comprehensive industry needs assessment and meeting with stakeholders from the aquaculture and commercial fishing industries to understand their needs and how they may use the pier.  GMRI is involved because it works with working waterfronts on economic development, and Vonderweidt said within 10 miles of the pier there are 50 start-up sites as well as six commercial leases to grow mussels, oysters and kelp.  The city is considering allowing designated space for aquaculture farmers to use the pier, but one aquaculture farmer in attendance said it is a year-round, everyday business, so seasonal facilities and seasonal access are automatic disadvantages. The city, consultants, and fishermen must identify a functional design that supports all needs, he said. Designs may be for half commercial fishing use and half aquaculture, or two piers may be built to accommodate both uses, GEI consultant Varoujan Hagopian suggested duting a December meeting.  He added the breakwater needs to be bigger, and must adequately protect the pier. He said a rock breakwater takes up a lot of space, and a wave screen would offer the same protection from the winds and use less space. Hagopian acknowledged parking at the pier will be an issue, and the design will have to be creative in looking at the area, and not just the property’s boundary lines. The properties on either side of the pier are privately owned, he noted.",neutral,seaweed aquaculture,2018,Maine
