,id_key,headline,body,headline_sentiment,relevance,year,region
1,9317,Cleaning Maine’s Coastal Waters: Are Seaweed Gardens the Answer? | Maine Public,"BOOTHBAY, Maine — Seaweed cultivation has been promoted in recent years in Maine as a way to produce local nutritious food and to boost the coastal economy. Now, seaweed harvesters say their industry provides yet another benefit: environmental protection, in the form of improving water quality. A new study from Bigelow Laboratory for Marine Sciences in Boothbay indicates growing and harvesting seaweed may be an antidote for increasing carbon and acidity levels in the ocean, which is harming a variety of marine life. Since January 2016, the lab has been studying the effect of kelp growth on surrounding carbon levels at the Ocean Approved seaweed farm off Great Chebeague Island in Casco Bay. The early results indicate that sugar kelp absorbs carbon from the surrounding water as it grows. This is prompting the lab to expand its research on kelp and to conduct a separate study on the carbon-absorption abilities of wild-grown rockweed. Kelp is a long, flat, leathery type of seaweed that creates “forests” where it grows in bunches below the low tide line. Rockweed is a shorter, more tangled plant that attaches to rocks both in the intertidal zone and below the low tide line. “Our research indicates that sugar kelp absorbs incredible amounts of carbon as it grows, creating a ‘halo’ of higher water quality around it,” said Nichole Price, a senior research scientist at the lab and the director of the lab’s Center for Seafood Security. According to Price, in the six months that scientists measured carbon dioxide levels in and around the 3-acre kelp farm, they found the kelp was absorbing carbon at the same rate carbon levels are expected to increase in the Gulf of Maine over the next 100 years from global use of fossil fuels. The initial findings are significant because increasing carbon levels are making the ocean more acidic. Higher carbon levels in the marine environment are linked to temperature-related die-offs of coral reefs, shift in species distribution as fish seek out colder waters richer in oxygen, and the spread of shell disease among lobster, primarily off the southern New England coast. Acidification resulting from higher carbon levels also poses a threat to bivalve shellfish species such as oysters, mussels, scallops and clams, all of which are commercially grown and harvested in Maine waters. Economic impact  In 2015, the most recent year statistics are available for Maine, commercially harvested oysters, clams, mussels, scallops, etc., accounted for more than $36 million in revenue, of which more than $22 million came from softshell clams alone, according to Maine Department of Marine Resources. The $36 million total represents nearly a $15 million increase since 2010, when the total statewide landings value of those same marine bivalve species was $21.7 million. Over that same period, the volume of those harvests decreased by more than 3 million pounds, from 12.3 million pounds in 2010 to less than 9 million pounds in 2015. “The importance [that harvesting seaweed will have] to the shellfish industry will only increase,” Price said. The annual value of Maine’s seaweed harvest has held steady, hovering between about $500,000 and $750,000 since 2011, state statistics indicate. Over that same time period, the volume of Maine’s annual seaweed harvest has been at historic highs, remaining above 15 million pounds each year over the past five years. Seaweed cultivation in Maine has been paired with fish and shellfish aquaculture for years, according to people familiar with the industry. Shep Erhart of Maine Coast Sea Vegetables, who serves as president of the Maine Seaweed Council, said seaweed has aided salmon and other finfish aquaculture because it absorbs the high level of nitrogen within the excrement released by the schools. Ocean nitrogen also tends to be high in areas where agricultural runoff drains into the sea, according to Price, which led shellfish growers to use seaweed in their operations, too. But in Maine, where the impact of agriculture on coastal waters is relatively low compared to other states, the seaweed appeared to have less impact on nitrogen levels and more of a general positive impact on the health of the shellfish being cultivated, she said. “We don’t have the type of agriculture runoff problems that the mid-Atlantic [shoreline] does,” Price said. But the Gulf of Maine’s does have comparatively lower temperatures, she added, which makes it more susceptible to carbon absorption. Erhart said Bigelow Lab’s research is the first scientific evidence of which he’s aware that demonstrates seaweed cultivation and harvests can reduce carbon levels. Large-scale harvesting of seaweed then, like clear-cutting forests on land, likely would have an overall negative impact, he added. “The seaweed is actually giving something back” to the balance of the coastal marine environment, Erhart said. “Taking some of it on a regular basis in moderation can help with the larger issue of ocean acidification.” Growth stage is key  According to Price, the lab’s key finding is that the carbon-absorption of kelp corresponds to its stages of growth. Sugar kelp has a life cycle of only about two years, and it grows the most in the spring. It is during this heavy growth period that kelp absorbs carbon, which it later releases into the water as it ages and dies, she said. This is why harvesting the kelp is deemed important. Removing mature kelp and ‘planting’ new stalks — cultivated in land-based nurseries before being transferred to lease sites — ensures that carbon captured by the growing kelp is not released later, according to Price. Bigelow Lab now plans this year to measure carbon levels in the ocean around its lease site by using a boat outfitted with carbon sensors to take readings in concentric circles around the site off Great Chebeague, which will help scientists determine how the rate of carbon absorption changes with distance from the kelp beds. The lab also plans to use money from the Department of Marine Resources’ seaweed management fund, which is funded by harvester license fees, to research carbon absorption rates for rockweed. If the studies are promising, she said, the lab hopes to raise money for field research on rockweed in 2018. Hale Miller, a lobsterman who fishes out of Tenants Harbor, also has been harvesting rockweed for the past year or so. He typically cuts several thousand wet pounds of the seaweed species per day, four or five days per week, often along the Muscle Ridge Islands in Penobscot Bay. He does it during the winter, when he hauls his lobster traps out of the water and waits for the crustaceans to return back toward shore in the spring. Miller said part of his interest in harvesting rockweed, aside from the extra money, is the ecological benefit along the shoreline. The shallow water near the coast serves as a nursery for a variety of commercially harvested marine species, he said, and reducing water carbon levels there would help a variety of different creatures. “It’s affecting lobsters, it’s affecting scallops, it affects groundfish,” Miller said of ocean acidification. “[Seaweed harvesting] will help across the board — oyster aquaculture, the estuaries, everything.” Miller added that rules for harvesting wild rockweed are aimed at sustainability. The state requires harvesters leave at least 16 inches of the plant attached to the bottom when they cut the stalk, he said, which often results in the plants growing back more densely. “We’re leaving a significant amount of product on the bottom,” Miller said. “It’s kind of like ‘v’-notching [egg-bearing lobsters and throwing them back overboard]. It think it’s a good thing.”",bad,seaweed aquaculture,2017,Maine
2,9324,Island School Students Learn Ocean Science By Growing Kelp | Maine Public,"PORTLAND, Maine (AP) _ Students in Maine who have been learning about marine science will conclude their project by dropping kelp-growing lines in the water at the start of the winter growing season. The Peaks Island Elementary students have been participating in a program called KELP4KIDS. KELP4KIDS is a 12-week curriculum for second- through fifth-graders at the island school. Kelp is grown as a crop in Maine for use in food and other products. The Island Institute Education Director Yvonne Thomas says the students have been learning about how kelp aquaculture improves water quality and absorbs carbon dioxide in the ocean. They’ll drop lines Friday. Baxter Academy for Technology and Science senior Emma Christman has been working with the school and the Island Institute to teach students about marine life and the environment. The program resumes in spring. 
  ",neutral,seaweed aquaculture,2017,Maine
3,9332,'Aquaculture's Next Wave' Explores How Maine Entrepreneurs Are Navigating Changing Seas | Maine Public,"   This week we’re taking a deep dive into aquaculture and its potential to add real value to the state’s coastal economies. In “Aquaculture’s Next Wave” we will meet the innovators who are trying to take seafood farming to a new level in Maine. Worldwide, aquaculture now provides more than half the world’s seafood. Yet here in the U.S. and in Maine, it’s far behind wild caught harvest. At the same time, we in the U.S. import roughly 90 percent of our seafood. For some investors and entrepreneurs, including Maine lobstermen, that spells opportunity. Maine Public reporter Fred Bever spoke with Morning Edition host Irwin Gratz about aggressive exploration of new technologies and new markets for farmed seafood.  Gratz: Why is aquaculture important right now' Bever: It’s because marine ecosystems and economies are being disrupted. Actively farming fish, shellfish, even seaweed — that can be a hedge against disruption and, long term, maybe the most profitable response. There’s a growing set of Maine visionaries who are pursuing that. The planet’s oceans are always in flux and wild harvests have long been vulnerable to natural variation and overfishing, right' Yes, but with the oceans warming, the dynamics are accelerating, and that’s nowhere more true than in the Gulf of Maine. Scientists say the Gulf is warming faster than 99 percent of the world’s oceans, correct' That’s almost a truism now. We’ve seen epic disruptions in recent decades — the crash of cod, fisheries for marine shrimp, for urchin and now herring are all restricted, lobster populations are making a slow march ever north and east following the warming trends. That’s been good for Maine lobstermen, and for the state, correct' Absolutely. But scientists and even some lobstermen, like Jeff Putnam, who fishes 800 traps from Chebeague Island year round, worry that the boom will bust. Here he is: “Just got to the point where I was a little concerned that if something happens to the lobster resource that’s beyond our control, how am I going to make a living on this island for the next 20 or 30 years'” That’s why he started an oyster farm in a little cove on Chebeague just a couple of years ago. He’s teaching his kids how to lobster, sure, but also how to grow oysters. He wants them to be able to make a living on the island just as he and his father did. But it’s not just lobstermen who are taking up aquaculture' It’s entrepreneurs of all varieties, from young Mainers who are looking to build a future at home to international investors who are looking for new revenue streams, and big ones. Oysters have been a big story. Maine’s oyster production tripled over the last decade, right through the recession. But even oysters face some environmental challenges. We’ll be looking at one oyster grower who’s leveraging cutting-edge technology to protect his crop. He’s even trying to use it to get a leg up on his competitors. And new tech spells new opportunity. Yes, and the cool tech factor was almost everywhere I looked in reporting these stories. Scallop farmers adapting Japanese machinery to increase production, clean rooms where these massive vats of microscopic sea plants are grown entirely in the dark. You know those tiny glass eels that Maine fishermen are making bank on by shipping them to Japan' The Japanese grow them up to full size make them into sushi. Yes, well there’s a young woman in Maine who’s designing and building the first commercial eel growing operation in the U.S., over in midcoast. There are not one but two companies trying to scale up indoor salmon growing tech. So far they say they could supply more than a tenth of the country’s entire salmon consumption, if their home communities let them. That’s another part of this story. Conflict over aquaculture’s expansion. If the sector is to grow as much in Maine as some would hope, there’s going to be tension over public resources. Is there room on the water for everyone' Will shorefront retirees give up their coastal serenity' Where does all the fish poop end up' I spoke with one booster, Sebastian Bell, who runs the Maine Aquaculture Association. He says the sector is poised to grow as fast as 10 or 12 percent a year. But he says don’t suspect a sudden and unsustainable boom: “Aquaculture will be one of a number of solutions that will help the working waterfront survive in Maine. But it takes time to learn the skills that are needed for a new way to make a living, it takes time to build those businesses.” And that’s one of the most fascinating things about the sector. Entrepreneurs here in Maine are experimenting with a whole bunch of new ways to make a living from the changing seas around us. 
  ",good,seaweed aquaculture,2018,Maine
4,9333,"‘The Wave Of The Future Is Breaking, Right Here In Maine’ - Aquaculture And Maine Entrepreneurs | Maine Public","Maine's 21st century saltwater farmers are using new techniques and technology to produce scallops, oysters, salmon and eels — to name just a few. All this week Maine Public Radio is profiling innovators who want to take Maine's aquaculture industry to the next level.  Maine Public reporter Fred Bever has spent some time with these entrepreneurs, reporting for our series, ""Aquaculture's Next Wave."" He joined Nora Flaherty on Maine Things Considered to discuss the project.  Flaherty: Fred, you've been doing a lot of reporting on this. What's the bottom line' Bever: The bottom line is that Maine fishermen are increasingly turning to farming fish and shellfish as a hedge against uncertainty about the wild fisheries. Now, is that because the Gulf of Maine is warming so fast' Is it overfishing' It's both, and there are other factors, but the Gulf is warming faster than most saltwater bodies on the planet, which is disrupting ecosystems and wild-caught harvests. The herring fishery is recently in trouble — we’ve seen a lot about that in the news lately — but cod, urchin, Maine shrimp, they're all restricted now or completely off-limits. But the warmer waters have been good for lobster populations here and for the lobster industry, right' Incredibly good, we’ve seen record hauls this decade. But an appreciable number of lobstermen are not taking that for granted. Lobster populations are slowly moving north and east, herring for bait are an issue now, and the plight of the North Atlantic right whale threatens to force expensive, and maybe prohibitive, gear changes by fishermen. And many of today's lobstermen used to fish for cod, so they've seen how quickly a business model can sink. That's why Marsden Brewer, a lobsterman I met in Stonington, is branching out to farming scallops: ""You know I've seen the collapse of most of the fisheries...just the way it was set up to work, it wasn't sustainable. And this project here is looking at sustainability."" - Brewer He's adapting Japanese farming techniques and machine’s to Maine's waters. Technological innovation is a big part of what's going on. The wave of the future is breaking, right here in Maine. The Japanese scallop tech is spreading. And there's a young woman Down East who's growing eels to full-size, indoors. That's a technological first in the U.S. An oyster-grower in the Damariscotta estuary just designed and built a whole new facility just to protect his crop against the challenges of climate change. Is the sector really growing that much though' It's dwarfed by the lobster industry, certainly. But there is excitement, it’s palpable. All these advances could mean jobs into the future, particularly for young people who are looking for new ways to make a career in-state, and not just on the water. I saw that when I visited a restaurant called the Shuck Station in Newcastle a few weeks ago. Owner Brendan Parsons is a native Mainer, still in his 20s…He says he's all about aquaculture: ""And obviously I focus on oysters, but then also talking about other aquaculture regarding muscles, experimental scallop farms, seaweed farms, even eel farms."" - Parsons That day [when I spoke to Brendan], the local oyster river-harvest had been shut down because of runoff from some heavy rains. But because of that oyster innovator down the road, Parsons was able to secure a ready supply of fresh-harvested oysters: ""Damn right I did, and they’ve been really pivotal to everything I’ve done."" - Parsons There's really a sense of momentum behind farmed seafood in Maine. But it's not about everyone getting together and singing Kumbaya… Sometimes, but sometimes not, especially when ‘Big Aqua’ tries to move in, it seems. We're seeing that in Belfast, where Norwegian investors are proposing to scale-up indoor salmon farming technology to a new scale, investing millions of dollars, and drawing a lot of local opposition. A forty-acre oyster farm, and that’s pretty big for Maine, is being proposed in the Maquoit Bay, not far from Brunswick. It's getting resistance. We'll look at those kinds of conflicts, and whether there may be limits on just how fast this sector, which depends on public resources, can grow. Well I cannot wait to hear this series, I'm looking forward to it, starting tomorrow on Morning Edition. Thanks Fred.  Thank you, Nora.",good,seaweed aquaculture,2018,Maine
5,9358,Organic Maine Seaweed Firm Wants To Make Your Table Salt Obsolete | Maine Public,"A Gouldsboro organic seaweed aquaculture firm is hoping to lease a site in Frenchman Bay that could help to significantly boost its output. Springtide Seaweed, a company founded in 2017, already operates a 35-acre cultivation site in the bay, off Preble Island in Sorrento. If it is granted a lease for a 20-acre site off Stave Island, it could triple the annual output of its finished, dry product to 75,000 pounds, according to company officials. The company has applied to the Maine Department of Marine Resources for a 10-year lease for a site west of Stave Island. On Tuesday, a public hearing on the application was held at the town office in Gouldsboro. None of the half dozen members of the public who attended the half-hour hearing raised any objections to the proposal. The state is expected to make a decision on the lease application within 120 days, according to DMR’s Flora Drury. Springtide Seaweed grows mainly kelp but also is developing products from dulse and nori seaweed varieties, according to Sarah Redmond, founder of the company. The firm converts the kelp into different products at its processing site in the village of South Gouldsboro, which the company just moved into last year. Among its products are powders that can be used as culinary seasonings and salt substitutes. Redmond, a longtime associate with the federal Sea Grant program, said Tuesday that she has been involved in seaweed aquaculture since 2010 and continues to develop methods for seaweed cultivation at the University of Maine’s Center for Cooperative Aquaculture Research in Franklin. “I want kelp on every table in America,” she said. “It is nature’s true healthy salt.” Redmond said there is a lot of room for growth in Maine’s aquaculture industry, and that it can be done sustainably without competing with other marine activities. Operations at the Frenchman Bay site would take place from September through the end of June, with seaweed growing through the winter, Redmond said. The seasonality of the operation would help minimize conflicts with lobstermen, who tend to set traps near shore in the summer but further out to sea in the fall, when lobster fishing is heaviest, she said. “Most of the activity takes place in the spring when you have to harvest the lines,” she said. In the fall, the lines will be seeded with seaweed spat that the company cultivates on land. The lines — nine in all — would measure about 1,000 feet long and would run parallel to each other and to the surface of the water. A recent petition submitted by lobstermen to state officials about limiting aquaculture operations shows how important it is to find lease sites that have little to no impact on other marine activities, Redmond said. “Anyone that applies for an aquaculture lease should take a lot of time to understand what the [surrounding] uses are and where their proposed efforts will fit into that waterfront,” Redmond said. “We have a significant amount of water out there, but there are a lot of people to work with. I think site selection is one of the most important things we can do to avoid these conflicts.” She was particularly interested in the site west of Stave Island because in 2012 it was approved for use as a cod farm that never materialized, she said. When that proposal was submitted to DMR, no one raised any objections. “It isn’t an area that is heavily utilized,” Redmond said. Springtide also is partnering with College of the Atlantic in Bar Harbor, where it has helped students learn about organic seaweed cultivation and hopes to develop a wet research lab. She said she wants to share what she has learned about organic seaweed aquaculture and help the industry grow and be sustainable. “We very much want to partner with them,” Redmond said. “If we had more people working with food systems in the ocean, I think we’d have a lot more attention being paid to water quality, to impacts of other activities in Bar Harbor and around the bay, and that’s really important.”",bad,seaweed aquaculture,2019,Maine
