,id_key,headline,body,headline_sentiment,relevance,year,region
52,9713,Sea Change - The Maine Mag,"At Atlantic Sea Farms’ production facility in Saco, a small group of women in hairnets and gloves are packing freshly blanched ribbons of deep green kelp into plastic bags. President and CEO Briana Warner offers me a taste, and the pleasantly crunchy strands remind me not so much of the sea as, surprisingly, of green beans. Its versatile ﬂavor is just one reason to embrace this nutrient-dense, sustainable Maine product. In just 18 months, Warner has transformed and rebranded Ocean Approved, which originated in 2009 as the ﬁrst commercial seaweed farm in the United States, into a model of culinary innovation and forward-thinking economic development with the motto “Kelp the earth.” This year, Atlantic Sea Farms will work with 24 ﬁshermen from Casco Bay to Eastport (up from 16 in 2019) and expects to harvest 600,000 pounds of fresh kelp. The kelp plants are started on kite string in ﬁltered seawater at the Saco facility and given to the ﬁshermen, who coil the string around rope and submerge it seven feet underwater. The mature kelp is harvested, cleaned, cut, blanched, and frozen. It is then offered in packages of ready-cut kelp and pureed kelp cubes for food service and retail. And last fall, the company rolled out its ﬁrst jarred products: Fermented Seaweed Salad, which is made with blanched kelp, and Sea-Beet Kraut and Sea-Chi—a mild kimchi—both made from raw kelp fermented in barrels by a woman-owned small business in Rhode Island.  Q. Why should we eat kelp'  A. We call it the virtuous vegetable.  It’s fresh, it’s American, it’s clean, it’s farmed by ﬁshermen (not on big farms), it helps mitigate ocean acidiﬁcation, it’s super healthy, and it tastes good. It’s got more calcium than milk—more calcium per ounce than any food on the planet. It’s super high in potassium and iodine, which is great for thyroid function, and potassium, magnesium, and vitamin B12. Our fermented seaweed products have a ton of probiotics, which is good for gut health, and our kelp cubes add a nutrient boost to smoothies. They’re an incredible way to eat greens and get these nutrients for people who would not eat a seaweed salad—like my two young kids.  Q. What makes kelp farming such a good thing for Maine' A. I’m a development economist by trade, and I think the most fascinating way development economics can be applied is by helping to prevent a problem before it ever happens. As we know, the Gulf of Maine is warming faster than 99 percent of the world’s oceans, and the dominant ﬁshery on the Maine coast is lobster. Right now, we’re in the middle of a lobster boom, which means if we’re looking for ways for ﬁshermen to diversify their incomes in the face of impending climate change, they already have the boats, the equipment, and the capital. It’s a workforce of owner-operators who are super-qualiﬁed; they have a huge advantage over anyone else who wants to get into aqua-culture. Kelp is a lower-capital-barrier investment than other types of aquaculture, and kelp grows in the opposite season from lobster; it’s a winter crop, so it’s out of the water and proﬁtable, if you grow it at scale, before you have to put your lobster traps in. Another factor is that kelp not only helps people adapt to climate change, it also helps mitigate climate change. We have too much carbon in the air, which along with nitrogen from other sources is being absorbed by the ocean, making it more acidic. A shelled organism like a mussel or an oyster in a more acidic ocean is going to become increasingly more brittle. When you’re planting kelp, you’re creating an additional habitat, and when you pull it out, you remove carbon and nitrogen from the water. We did some research with the Bigelow Laboratory for Ocean Sciences, growing mussels alongside our kelp, and found that the shells were almost doubly as strong in one six-month growing period. The mussel meat was also substantially larger, which could be part of the ocean acidiﬁcation piece, or that they were feeding off the nutrients from the kelp. Q. What are some good ways to use the ready-cut kelp'  A. It’s been our biggest seller in food service because chefs like to make their own, better version of the seaweed salad you see in sushi bars [which is dried, reconstituted, and dyed seaweed grown in Asia in water with a high lead content]. We have a recipe for the salad right on the retail package. A lot of people put it on salads; it adds a really great crunch. At her restaurants, Linda Bean puts it in a signature slaw called Kelpi-slaw. If you want to get a little more creative, it’s fantastic in pasta sauces, especially clam sauce, and paella, but you can also put it in soups such as minestrone, because the ﬂavor is fresh and vegetal.  Q. What was the reasoning behind the fermented kelp products' A. We made a baseline assumption that people who are seeking to eat seaweed are likely more adventurous and health focused, and probably more conscious about where their food is grown. The probiotic craze is really catching on; it’s the fastest growing grocery segment, yet it’s basically just kimchi, sauerkraut, and kombucha. We thought if we could innovate in the seaweed space and innovate in the fermented space that consumer group would be substantial. But we also needed to preserve it and an easy way to eat it. Fermentation works really well with seaweed, and it boosts the nutrients. Our Sea-Chi and our seaweed kraut are both raw, which helps people who are on the raw diet, and with our seaweed salad, we can make a healthier, more delicious, natural version of the seaweed salad usually found at sushi bars. It’s really easy to use right out of the jar, it tastes great, and it’s preserved for a year.",neutral,seaweed aquaculture,2020,Maine
53,9722,Freeport + Yarmouth in 48 Hours - The Maine Mag,"Cozy suites and good eats Start your weekend with a warm welcome at Porters Landing Guest House, which has two spacious suites. The one-bedroom Schooner suite boasts a gas fireplace flanked by a built-in bookcase full of good reads, comfy chairs to sink into, all the kitchen necessities you could ask for, and super-plush bath towels. Head into downtown Freeport for some sustenance. Cozy up to the bar at the Broad Arrow Tavern at the Harraseeket Inn and take in the distinctly Maine decor, like a large wall-mounted moose head alongside framed pictures of Maine wildlife. A Cold River gin martini is just the ticket to kick off your weekend. Drive to the other end of Main Street, where you’ll find the spacious and brightly lit Mast Landing Brewing Company, the newest addition to Freeport’s brewery scene, with 16 beers on tap. The brewery’s Nighthawk Kitchen serves upscale bar food through a convenient pickup window. Try one of their juicy burgers or their brussels sprout Caesar, and wash it down with Gunner’s Daughter on nitro, Mast Landing’s most popular stout. Main Street shopping and coastal exploration Begin the day with a homemade cinnamon bun from Isabella’s Cafe and Bakery, or try one of the hearty made-to-order omelets. Freeport is known as a shopping destination, anchored by L.L.Bean’s iconic flagship store. However, recently the storefronts in town have been changing as some national chain outlets are replaced by local boutiques and galleries. Visit the colorful and whimsical Palmer and Company to find unique coffee-table books, greeting cards, housewares, and children’s toys. Owner Meghan Palmer has curated her store to make it a happy place, saying that she wants it to be “the Ted Lasso of shops.” Nearby you’ll find Brown Goldsmiths, a Freeport institution. The jeweler offers heirloom pieces, many of which are handcrafted in the studio above the shop. Check out their Compass collection and their Maine-themed charms. Just down Bow Street is the appropriately named Bow Street Home. With a seaside aesthetic, it’s a warm and funky boutique filled with furniture, artwork, and tabletop designs. If you’re looking for some New England-meets-Malibu decorating inspiration, you’re in the right spot. Farther up Bow Street is the recently opened Stio, where you’ll find outerwear designed and inspired by life in the Tetons. The Wyoming company’s shop is full of brightly colored jackets, pants, half-zips, and more to keep you warm on the slopes (or wherever you are doing outdoor activities). Next door is Fiore Artisan Olive Oils and Vinegars, which encourages customers to sample its offerings. A couple of our favorites are the Persian lime olive oil and the Amarena cherry balsamic. Ready to eat again' Drive over to Bow Street Market to pick up some lunch nibbles and, perhaps, choose a bottle or two from their extensive wine collection. Then explore the Harraseeket Historic District, which includes Porters Landing, South Freeport, and Mast Landing. If it’s low tide at Porters Landing, you’ll get to see remnants of shipyards past protruding from the banks. If the tide is high and the weather warm, this is an excellent spot to put in a kayak or take a refreshing dive off the dock. Take your picnic lunch to the Freeport Town Landing in South Freeport, where commercial oyster farmers keep their boats. You can tour the oyster- and kelp-growing operation of Spartan Sea Farms in Casco Bay with owner Ken Sparta, who will soon be opening Freeport Oyster Bar. The farm is part of the Maine Family Sea Farm Cooperative, a group of local aquaculture businesses. Leaving South Freeport en route to Yarmouth, drive slowly to admire the quintessential New England houses that dot the coastline. Many of these Federalist-style homes were owned by the shipbuilders who settled here in the nineteenth century. Stop in at Gingham, a women’s clothing store on Main Street that offers elevated everyday wardrobe staples. Owner Heather Veitch also curates a sampling of home gifts, most of which are made in Maine. Then pop in next door to Royal River Books  to browse for your next read. Before dinner, have some “Lunch,” Maine Beer Company’s popular IPA. The spacious tasting room and brewery on Route 1 in Freeport serves up thin-crust pizzas topped with local farm ingredients. Next, head back to Yarmouth for dinner at The Garrison, located in the Sparhawk Mill building along the Royal River. Chef Christian Hayes has created a space that at once feels cozy and cosmopolitan. The food is both comforting (like the short-rib pappardelle) and adventurous (like the slow-cooked pork belly plated on top of egg scramble with charred scallions, spicy pork salami, and sesame panko). Yarmouth boasts an impressive selection of restaurants for its size. Try Gather for farm-to-table fare or Owl and Elm for creative, thoughtful pub food. Keeping it local After checking out, make a few more uniquely Maine stops in Freeport. Sherman’s Maine Coast Book Shop, the oldest bookstore in Maine (first established in 1886 in Bar Harbor), has a large section of books by Maine authors and about the state, including the entire collection of mysteries by writer Paul Doiron. Pop in to the Maine Organic Farmers and Gardeners Association’s Maine Organic Marketplace, located in the old library building at 55 Main Street. There, in addition to Common Ground Fair merchandise, you’ll find Maine-made goodies such as organic maple syrup from Tree of Life Maple Farm, hand-knit hats from Salt and Wool, organic skincare from Leila Belle, and organic granola from Grandy Oats. Then head down to the Freeport Market in Freeport Village Station. Here, Maine artisans showcase their wares, including candles, jewelry, buoy doorstops, and more. As you head out of town toward Yarmouth, stop in at Chilton Furniture, a Maine-based company producing Shaker-style furniture, much of which is handcrafted in local workshops. For your final meal, head back to Yarmouth for a leisurely brunch at the Royal River Grill House. Try to secure a table by the windows that face the river, and be sure to order a Royal Mary, a generous Bloody Mary served with olives and a lemon-marinated shrimp skewer. Finally, make your way out to Littlejohn Island Preserve to complete your weekend. Stopping to walk around this coastal trail involves a little bit of luck, as there are only four parking spaces. But even if there’s no parking, the beautiful drive across Cousins Island to Littlejohn is the perfect way to round out your weekend visit to these coastal towns.",neutral,seaweed aquaculture,2022,Maine
54,9742,Former House Leader Seth Berry transitions into private sector with Kennebec River Biosciences | Mainebiz.biz,"Seth Berry of Bowdoinham served in the Maine Legislature for eight years (2006–14), ending his term as House majority leader. In January, Berry was hired by Richmond-based Kennebec River Biosciences as vice president for international business development. KRB, founded in 1996, provides testing and health services to farms, businesses, government agencies and scientific research institutions involved with aquatic species. KRB expects to double its staff over the next several years, from the current 14. Mainebiz recently chatted with Berry. An edited transcript follows. Mainebiz: How has your transition gone, moving from the public to the private sector'  Seth Berry: It's been great. Something I've thought about a lot in my time in the public sector is, How do we prepare our young people and our incumbent work force for the next economy' How do we make sure Maine is relevant in the global economy' I talked with a lot of business owners, scientists and non-profit folks who work in this arena. I've really done a lot of listening. It's really an exciting space, the innovation that's happening in Maine, just as it is in Silicon Valley or the beltway in Boston. Maine is clearly doing some great things. Often by boot strapping. But often by getting public support, as well, like from the Maine Technology Institute. MB: How did you pick Kennebec River Biosciences'  SB: In 2006, I was campaigning. I knocked on every door in the district. CEO Bill Keleher and office manager Rebecca Boulanger welcomed me into their offices. I was blown away by the kind of work they were doing. Very advanced, scientific diagnostic work supporting fisheries, fish farms, the health of aquatic animals. The lab was continually an example of the kind of business that we want to grow more of here in Maine, to make sure our state is relevant. KRB is providing a service and product that can't be outsourced. It adds value to Maine's economy and builds on a unique strength. We have a long tradition of fishing in Maine and this is one evolution of that history. MB: Research suggests more of the global diet will rely on fish and more of that fish will be farmed. How is KRB positioned to serve the farms that will support these trends'  SB: Yes, the kind of science we provide allows fish farmers to be more proactive, as opposed to reactive, in monitoring and supporting the health of their animals and in producing much healthier, fresher, tastier fish as well. Using very targeted vaccines really helps the fish farmers get away from the use of antibiotics. We also support farmers with better management techniques. They may not need a vaccine or health product. Sometimes, it's just understanding what pathogens you have in your aquatic environment and preventing them from erupting into a full-scale disease. We're all swimming in a sea of microbes. How do we use those beneficial microbes as well, for example. Science can help bring fish farming into a more responsible, more sustainable era. MB: One of your clients is an Idaho farmer who converted his cattle operation to a tilapia farm. With aquaculture becoming so popular, what's hot within the sector'  SB: It's not just catching more fish these days. It's utilizing more fully the fish that are harvested. There's a lot of interest right now in 'How do I get more from the fish that I'm bringing to market'' Are there parts of the fish that can be sold for something other than compost' Those are areas we've been supporting and bringing our science to bear. Centuries ago, Native Americans planted corn and beans together because the beans were nitrogen fixers. You can do similar things in aquaculture. It's called integrated multi-trophic aquaculture. It involves combining several species that benefit from one another's presence. For example, people are experimenting with farming fish, shellfish and seaweed together. Also, the industry is really moving forward in land-based recirculating aquaculture systems. It's absolutely astonishing how much is going on in this arena and how good the farm-to-product can be.",neutral,seaweed aquaculture,2015,Maine
55,9758,"Maine Food Insider: Edible seaweed, the next great Maine brand? | Mainebiz.biz","Edible seaweed is nothing new. Along Ireland's rocky coast, seaweed has been harvested for food for centuries, even, legend has it, brought along as a provision by St. Brendan on his fifth-century voyage to find paradise. It's a staple of Asian food and no sushi bar is without it. But Maine edible seaweed' Definitely not the stuff of legends, or even of most dinner tables. The Island Institute in Rockland is hoping to change that, foreseeing a future where edible seaweed is not only a Maine brand but also a sustainable addition to the economy island and coastal communities that depend so heavily on fishing and lobstering. On Friday the Island Institute will release a study that shows the possibilities for Maine's edible seaweed industry — from processing to packaging and selling locally. ""There's the potential for Maine to be the leader"" in processing and selling edible seaweed, Briana Warner, Island Institute's economic development director, told Mainebiz on Tuesday. The growth of the state's edible seaweed industry would not only put more local food into the marketplace, it also would give needed diversification for the state's fishing and lobster industries. So far, 48 people have taken part in the institute's training program, which also focuses on oyster- and mussel-growing. The training, which is in its second year, is more of a business support program than actual training, Warner said, explaining that it connects those who want to become seafood growers with the technical resources and information they need. Warner said those who have participated in the institute's program are new to seaweed growing, but familiar with working on the water. Seaweed is perfect for those who already harvest the ocean: it's a cold-weather crop and is not labor-intensive. ""They understand the water so well, and the technical side is fairly easy to learn,"" Warner said, adding that it also doesn't require a huge investment in capital to get started. Of course, a product needs a consumer, or it's not a product. ""Oysters and mussels are well established,"" she said. ""The edible seaweed supply chain is very small, it's limited."" According to the institute, ""Despite potential growth opportunities, the domestic market for edible seaweed and seaweed products remains underdeveloped, with minimal focus on value-added products."" That's where the study comes in. The institute commissioned the study to determine the market for edible seaweed and how it will work. The event, to be held at the University of Southern Maine, is for industry leaders, entrepreneurs and potential seaweed processors, who will hear about ""new and innovative ways to process, package and sell edible seaweed products,"" a news release about the event says. Speakers will include Sebastian Belle, of the Maine Aquaculture Association and Des Fitzgerald of the Maine Venture Fund. There will even be recipes. For instance, pork and beans with sugar kelp. ""It actually softens the beans faster, and adds a lot of flavor,"" Warner said. Or French onion soup, with sugar kelp instead of onion. ""It tastes a lot like French onion soup, but is packed with vitamins,"" she said, noting that the kelp is flavorful and a little salty and once cooked has a crunchy noodle texture. The institute worked with a chef to come up with recipes that are familiar to people, as well as make the best use of other Maine products. The plant is also nutritious. Low in calories and considered a superfood, it's loaded with antioxidants and nutrients, with one of the most essential being iodine, an essential mineral that many people don't get enough of in their diets. Warner said most of the seaweed sold commercially in the U.S. comes from Asia, harvested from water less clean than Maine's, and is dyed or processed in other ways. One of the reasons the product is custom-made for Maine is the clean, cold northern Atlantic water, which adds flavor and value, Warner said. The seaweed also complements other locally produced seafoods and vegetables. ""It's a natural Maine product,"" she said. The University of Maine's seaweed guide says that while many of the 250 types of seaweed are edible, only 11 are commercially harvested. It lists eight companies that harvest or market locally grown seaweed in the state. Warner said there is anecdotal proof that edible seaweed is a desired product. ""It would be a great brand for our seafood industry,"" she said. ""Nobody else in the country is really doing it.""",good,seaweed aquaculture,2017,Maine
56,9770,Briana Warner named CEO of Ocean Approved | Mainebiz.biz,"Ocean Approved Inc. announced today that its board of directors has unanimously chosen Briana Warner as the company's next chief executive officer. Warner is currently serving as senior community development officer at the Island Institute and will succeed CEO Paul Dobbins on July 2. Dobbins is leaving the Portland-based company to begin a new job in Washington, D.C. Founded in 2006, Ocean Approved farms, processes and sells kelp and kelp products. According to its website, it not only harvests kelp from its own farms it also works with farms operated by nine fishermen along the Maine coast. It's currently in a growth mode, focusing on responding to market demand by expanding its processing capacity and entering into buying contracts with more kelp farmers in Maine, according to a ""success story"" posted by CEI on its website. ""I am thrilled to be part of this exciting new industry in Maine,"" Warner said. ""Edible sea vegetables are healthy for the ocean and consumers and have endless possibilities for culinary innovation. I am excited to be stepping into a company that makes delicious and healthy products. I am also motivated by Ocean Approved's community-based supply chain, sourcing its line-grown seaweed directly from Maine's hard-working fisherman."" In a telephone interview with Mainebiz this morning, Warner said she sees her new venture with Ocean Approved as a natural progression of work she's been doing at Island Institute, the Rockland-based nonprofit that is working to sustain island and coastal communities in Maine. During her tenure at the Island Institute, she created a program that helped fishermen diversify into seaweed and shellfish aquaculture and is looking forward to working closely with many of those same fishermen at Ocean Approved. Whether it's growing oysters, mussels or various forms of seaweed, Warner said aquaculture increasingly is providing opportunities for Maine fishermen to create for themselves ""a diversified income stream."" Warner added that she's looking forward to returning to the food sector. Prior to joining the Island Institute she started, owned and then sold the Maine Pie Line, a highly acclaimed bakery that sold sweet and savory pies and created jobs for newly resettled refugees in Maine. And before that, she served as a diplomat in the U.S. Foreign Service in Libya, Guinea and the U.S. Mission to the European Union. ""I am thrilled to see Briana take the lead at Ocean Approved,"" said outgoing CEO Paul Dobbins. ""Given her track record of success at the Island Institute, broad industry contacts, and performance as an Ocean Approved board member, she is well positioned to take the company to the next level.'' Dobbins is stepping down from management of Ocean Approved and will be moving to Washington, D.C., to join a nonprofit. In his new role he will be helping to identify trends in marine algae aquaculture to sequester carbon while providing critical food and food ingredients that reduce key environmental impacts. Warner will join a seasoned management team with sales, marketing, processing and food safety experience. While the initial focus will be to continue to grow food service distribution and sales, she will spearhead the effort to bring Ocean Approved into the retail sector and innovate new products that will help expand the market for sea vegetables in the U.S. ""I've been brought on to focus on expanding into retail markets,"" Warner said. ""I saw this company as being an incredible innovator … It's time to look into the the retail market.""",neutral,seaweed aquaculture,2018,Maine
